Sheet: Overview
A1: Work time tracking | C1: 2018 | D1: <- change this for next year and the sheets will auto update the year
B2: Length of work day (h) | C2: hourly rate
B3: 7.35 | C3: 20 | D3: percentage of full time | E3: work dayz
A4: Total in: | B4: h | C4: €
A5: of:=DATE([$Overview.$C$1];1;1) -> 2018-01-01 | B5: of:=SUM([$January.$B$2:.$B$32]) -> 0 | C5: of:=[.B5]*[.$C$3] -> 0 | D5: of:=[.B5]/([.E5]*[.$B$3]) -> 0 | E5: of:=NETWORKDAYS([.A5];EOMONTH([.A5];0)) -> 23
A6: of:=DATE([$Overview.$C$1];MONTH([.A5])+1;1) -> 2018-02-01 | B6: of:=SUM([$February.$B$2:.$B$32]) -> 0 | C6: of:=[.B6]*[.$C$3] -> 0 | D6: of:=[.B6]/([.E6]*[.$B$3]) -> 0 | E6: of:=NETWORKDAYS([.A6];EOMONTH([.A6];0)) -> 20
A7: of:=DATE([$Overview.$C$1];MONTH([.A6])+1;1) -> 2018-03-01 | B7: of:=SUM([$March.$B$2:.$B$32]) -> 0 | C7: of:=[.B7]*[.$C$3] -> 0 | D7: of:=[.B7]/([.E7]*[.$B$3]) -> 0 | E7: of:=NETWORKDAYS([.A7];EOMONTH([.A7];0)) -> 22
A8: of:=DATE([$Overview.$C$1];MONTH([.A7])+1;1) -> 2018-04-01 | B8: of:=SUM([$April.$B$2:.$B$32]) -> 0 | C8: of:=[.B8]*[.$C$3] -> 0 | D8: of:=[.B8]/([.E8]*[.$B$3]) -> 0 | E8: of:=NETWORKDAYS([.A8];EOMONTH([.A8];0)) -> 21
A9: of:=DATE([$Overview.$C$1];MONTH([.A8])+1;1) -> 2018-05-01 | B9: of:=SUM([$May.$B$2:.$B$32]) -> 0 | C9: of:=[.B9]*[.$C$3] -> 0 | D9: of:=[.B9]/([.E9]*[.$B$3]) -> 0 | E9: of:=NETWORKDAYS([.A9];EOMONTH([.A9];0)) -> 23
A10: of:=DATE([$Overview.$C$1];MONTH([.A9])+1;1) -> 2018-06-01 | B10: of:=SUM([$June.$B$2:.$B$32]) -> 0 | C10: of:=[.B10]*[.$C$3] -> 0 | D10: of:=[.B10]/([.E10]*[.$B$3]) -> 0 | E10: of:=NETWORKDAYS([.A10];EOMONTH([.A10];0)) -> 21
A11: of:=DATE([$Overview.$C$1];MONTH([.A10])+1;1) -> 2018-07-01 | B11: of:=SUM([$July.$B$2:.$B$32]) -> 0 | C11: of:=[.B11]*[.$C$3] -> 0 | D11: of:=[.B11]/([.E11]*[.$B$3]) -> 0 | E11: of:=NETWORKDAYS([.A11];EOMONTH([.A11];0)) -> 22
A12: of:=DATE([$Overview.$C$1];MONTH([.A11])+1;1) -> 2018-08-01 | B12: of:=SUM([$August.$B$2:.$B$32]) -> 0 | C12: of:=[.B12]*[.$C$3] -> 0 | D12: of:=[.B12]/([.E12]*[.$B$3]) -> 0 | E12: of:=NETWORKDAYS([.A12];EOMONTH([.A12];0)) -> 23
A13: of:=DATE([$Overview.$C$1];MONTH([.A12])+1;1) -> 2018-09-01 | B13: of:=SUM([$September.$B$2:.$B$32]) -> 0 | C13: of:=[.B13]*[.$C$3] -> 0 | D13: of:=[.B13]/([.E13]*[.$B$3]) -> 0 | E13: of:=NETWORKDAYS([.A13];EOMONTH([.A13];0)) -> 20
A14: of:=DATE([$Overview.$C$1];MONTH([.A13])+1;1) -> 2018-10-01 | B14: of:=SUM([$October.$B$2:.$B$32]) -> 0 | C14: of:=[.B14]*[.$C$3] -> 0 | D14: of:=[.B14]/([.E14]*[.$B$3]) -> 0 | E14: of:=NETWORKDAYS([.A14];EOMONTH([.A14];0)) -> 23
A15: of:=DATE([$Overview.$C$1];MONTH([.A14])+1;1) -> 2018-11-01 | B15: of:=SUM([$November.$B$2:.$B$32]) -> 0 | C15: of:=[.B15]*[.$C$3] -> 0 | D15: of:=[.B15]/([.E15]*[.$B$3]) -> 0 | E15: of:=NETWORKDAYS([.A15];EOMONTH([.A15];0)) -> 22
A16: of:=DATE([$Overview.$C$1];MONTH([.A15])+1;1) -> 2018-12-01 | B16: of:=SUM([$December.$B$2:.$B$32]) -> 0 | C16: of:=[.B16]*[.$C$3] -> 0 | D16: of:=[.B16]/([.E16]*[.$B$3]) -> 0 | E16: of:=NETWORKDAYS([.A16];EOMONTH([.A16];0)) -> 21
A17: Year total | B17: of:=SUM([.B5:.B16]) -> 0 | C17: of:=SUM([.C5:.C16]) -> 0 | D17: of:=SUM([.D5:.D16])/12 -> 0 | E17: of:=SUM([.E5:.E16]) -> 261
A21: HOW TO USE
A22: Individual dates can be found in sheets per month

Sheet: January
B1: Hours | C1: Comment
A2: of:=DATE([$Overview.$C$1];1;1) -> 2018-01-01
A3: of:=DATE([$Overview.$C$1];MONTH([.A2]);SUM(DAY([.A2])+1)) -> 2018-01-02
A4: of:=DATE([$Overview.$C$1];MONTH([.A3]);SUM(DAY([.A3])+1)) -> 2018-01-03
A5: of:=DATE([$Overview.$C$1];MONTH([.A4]);SUM(DAY([.A4])+1)) -> 2018-01-04
A6: of:=DATE([$Overview.$C$1];MONTH([.A5]);SUM(DAY([.A5])+1)) -> 2018-01-05
A7: of:=DATE([$Overview.$C$1];MONTH([.A6]);SUM(DAY([.A6])+1)) -> 2018-01-06
A8: of:=DATE([$Overview.$C$1];MONTH([.A7]);SUM(DAY([.A7])+1)) -> 2018-01-07
A9: of:=DATE([$Overview.$C$1];MONTH([.A8]);SUM(DAY([.A8])+1)) -> 2018-01-08
A10: of:=DATE([$Overview.$C$1];MONTH([.A9]);SUM(DAY([.A9])+1)) -> 2018-01-09
A11: of:=DATE([$Overview.$C$1];MONTH([.A10]);SUM(DAY([.A10])+1)) -> 2018-01-10
A12: of:=DATE([$Overview.$C$1];MONTH([.A11]);SUM(DAY([.A11])+1)) -> 2018-01-11
A13: of:=DATE([$Overview.$C$1];MONTH([.A12]);SUM(DAY([.A12])+1)) -> 2018-01-12
A14: of:=DATE([$Overview.$C$1];MONTH([.A13]);SUM(DAY([.A13])+1)) -> 2018-01-13
A15: of:=DATE([$Overview.$C$1];MONTH([.A14]);SUM(DAY([.A14])+1)) -> 2018-01-14
A16: of:=DATE([$Overview.$C$1];MONTH([.A15]);SUM(DAY([.A15])+1)) -> 2018-01-15
A17: of:=DATE([$Overview.$C$1];MONTH([.A16]);SUM(DAY([.A16])+1)) -> 2018-01-16
A18: of:=DATE([$Overview.$C$1];MONTH([.A17]);SUM(DAY([.A17])+1)) -> 2018-01-17
A19: of:=DATE([$Overview.$C$1];MONTH([.A18]);SUM(DAY([.A18])+1)) -> 2018-01-18
A20: of:=DATE([$Overview.$C$1];MONTH([.A19]);SUM(DAY([.A19])+1)) -> 2018-01-19
A21: of:=DATE([$Overview.$C$1];MONTH([.A20]);SUM(DAY([.A20])+1)) -> 2018-01-20
A22: of:=DATE([$Overview.$C$1];MONTH([.A21]);SUM(DAY([.A21])+1)) -> 2018-01-21
A23: of:=DATE([$Overview.$C$1];MONTH([.A22]);SUM(DAY([.A22])+1)) -> 2018-01-22
A24: of:=DATE([$Overview.$C$1];MONTH([.A23]);SUM(DAY([.A23])+1)) -> 2018-01-23
A25: of:=DATE([$Overview.$C$1];MONTH([.A24]);SUM(DAY([.A24])+1)) -> 2018-01-24
A26: of:=DATE([$Overview.$C$1];MONTH([.A25]);SUM(DAY([.A25])+1)) -> 2018-01-25
A27: of:=DATE([$Overview.$C$1];MONTH([.A26]);SUM(DAY([.A26])+1)) -> 2018-01-26
A28: of:=DATE([$Overview.$C$1];MONTH([.A27]);SUM(DAY([.A27])+1)) -> 2018-01-27
A29: of:=DATE([$Overview.$C$1];MONTH([.A28]);SUM(DAY([.A28])+1)) -> 2018-01-28
A30: of:=DATE([$Overview.$C$1];MONTH([.A29]);SUM(DAY([.A29])+1)) -> 2018-01-29
A31: of:=DATE([$Overview.$C$1];MONTH([.A30]);SUM(DAY([.A30])+1)) -> 2018-01-30
A32: of:=DATE([$Overview.$C$1];MONTH([.A31]);SUM(DAY([.A31])+1)) -> 2018-01-31

Sheet: February
B1: Hours | C1: Comment
A2: of:=DATE([$Overview.$C$1];2;1) -> 2018-02-01
A3: of:=DATE([$Overview.$C$1];MONTH([.A2]);SUM(DAY([.A2])+1)) -> 2018-02-02
A4: of:=DATE([$Overview.$C$1];MONTH([.A3]);SUM(DAY([.A3])+1)) -> 2018-02-03
A5: of:=DATE([$Overview.$C$1];MONTH([.A4]);SUM(DAY([.A4])+1)) -> 2018-02-04
A6: of:=DATE([$Overview.$C$1];MONTH([.A5]);SUM(DAY([.A5])+1)) -> 2018-02-05
A7: of:=DATE([$Overview.$C$1];MONTH([.A6]);SUM(DAY([.A6])+1)) -> 2018-02-06
A8: of:=DATE([$Overview.$C$1];MONTH([.A7]);SUM(DAY([.A7])+1)) -> 2018-02-07
A9: of:=DATE([$Overview.$C$1];MONTH([.A8]);SUM(DAY([.A8])+1)) -> 2018-02-08
A10: of:=DATE([$Overview.$C$1];MONTH([.A9]);SUM(DAY([.A9])+1)) -> 2018-02-09
A11: of:=DATE([$Overview.$C$1];MONTH([.A10]);SUM(DAY([.A10])+1)) -> 2018-02-10
A12: of:=DATE([$Overview.$C$1];MONTH([.A11]);SUM(DAY([.A11])+1)) -> 2018-02-11
A13: of:=DATE([$Overview.$C$1];MONTH([.A12]);SUM(DAY([.A12])+1)) -> 2018-02-12
A14: of:=DATE([$Overview.$C$1];MONTH([.A13]);SUM(DAY([.A13])+1)) -> 2018-02-13
A15: of:=DATE([$Overview.$C$1];MONTH([.A14]);SUM(DAY([.A14])+1)) -> 2018-02-14
A16: of:=DATE([$Overview.$C$1];MONTH([.A15]);SUM(DAY([.A15])+1)) -> 2018-02-15
A17: of:=DATE([$Overview.$C$1];MONTH([.A16]);SUM(DAY([.A16])+1)) -> 2018-02-16
A18: of:=DATE([$Overview.$C$1];MONTH([.A17]);SUM(DAY([.A17])+1)) -> 2018-02-17
A19: of:=DATE([$Overview.$C$1];MONTH([.A18]);SUM(DAY([.A18])+1)) -> 2018-02-18
A20: of:=DATE([$Overview.$C$1];MONTH([.A19]);SUM(DAY([.A19])+1)) -> 2018-02-19
A21: of:=DATE([$Overview.$C$1];MONTH([.A20]);SUM(DAY([.A20])+1)) -> 2018-02-20
A22: of:=DATE([$Overview.$C$1];MONTH([.A21]);SUM(DAY([.A21])+1)) -> 2018-02-21
A23: of:=DATE([$Overview.$C$1];MONTH([.A22]);SUM(DAY([.A22])+1)) -> 2018-02-22
A24: of:=DATE([$Overview.$C$1];MONTH([.A23]);SUM(DAY([.A23])+1)) -> 2018-02-23
A25: of:=DATE([$Overview.$C$1];MONTH([.A24]);SUM(DAY([.A24])+1)) -> 2018-02-24
A26: of:=DATE([$Overview.$C$1];MONTH([.A25]);SUM(DAY([.A25])+1)) -> 2018-02-25
A27: of:=DATE([$Overview.$C$1];MONTH([.A26]);SUM(DAY([.A26])+1)) -> 2018-02-26
A28: of:=DATE([$Overview.$C$1];MONTH([.A27]);SUM(DAY([.A27])+1)) -> 2018-02-27
A29: of:=DATE([$Overview.$C$1];MONTH([.A28]);SUM(DAY([.A28])+1)) -> 2018-02-28
A30: of:=DATE([$Overview.$C$1];MONTH([.A29]);SUM(DAY([.A29])+1)) -> 2018-03-01

Sheet: March
B1: Hours | C1: Comment
A2: of:=DATE([$Overview.$C$1];3;1) -> 2018-03-01
A3: of:=DATE([$Overview.$C$1];MONTH([.A2]);SUM(DAY([.A2])+1)) -> 2018-03-02
A4: of:=DATE([$Overview.$C$1];MONTH([.A3]);SUM(DAY([.A3])+1)) -> 2018-03-03
A5: of:=DATE([$Overview.$C$1];MONTH([.A4]);SUM(DAY([.A4])+1)) -> 2018-03-04
A6: of:=DATE([$Overview.$C$1];MONTH([.A5]);SUM(DAY([.A5])+1)) -> 2018-03-05
A7: of:=DATE([$Overview.$C$1];MONTH([.A6]);SUM(DAY([.A6])+1)) -> 2018-03-06
A8: of:=DATE([$Overview.$C$1];MONTH([.A7]);SUM(DAY([.A7])+1)) -> 2018-03-07
A9: of:=DATE([$Overview.$C$1];MONTH([.A8]);SUM(DAY([.A8])+1)) -> 2018-03-08
A10: of:=DATE([$Overview.$C$1];MONTH([.A9]);SUM(DAY([.A9])+1)) -> 2018-03-09
A11: of:=DATE([$Overview.$C$1];MONTH([.A10]);SUM(DAY([.A10])+1)) -> 2018-03-10
A12: of:=DATE([$Overview.$C$1];MONTH([.A11]);SUM(DAY([.A11])+1)) -> 2018-03-11
A13: of:=DATE([$Overview.$C$1];MONTH([.A12]);SUM(DAY([.A12])+1)) -> 2018-03-12
A14: of:=DATE([$Overview.$C$1];MONTH([.A13]);SUM(DAY([.A13])+1)) -> 2018-03-13
A15: of:=DATE([$Overview.$C$1];MONTH([.A14]);SUM(DAY([.A14])+1)) -> 2018-03-14
A16: of:=DATE([$Overview.$C$1];MONTH([.A15]);SUM(DAY([.A15])+1)) -> 2018-03-15
A17: of:=DATE([$Overview.$C$1];MONTH([.A16]);SUM(DAY([.A16])+1)) -> 2018-03-16
A18: of:=DATE([$Overview.$C$1];MONTH([.A17]);SUM(DAY([.A17])+1)) -> 2018-03-17
A19: of:=DATE([$Overview.$C$1];MONTH([.A18]);SUM(DAY([.A18])+1)) -> 2018-03-18
A20: of:=DATE([$Overview.$C$1];MONTH([.A19]);SUM(DAY([.A19])+1)) -> 2018-03-19
A21: of:=DATE([$Overview.$C$1];MONTH([.A20]);SUM(DAY([.A20])+1)) -> 2018-03-20
A22: of:=DATE([$Overview.$C$1];MONTH([.A21]);SUM(DAY([.A21])+1)) -> 2018-03-21
A23: of:=DATE([$Overview.$C$1];MONTH([.A22]);SUM(DAY([.A22])+1)) -> 2018-03-22
A24: of:=DATE([$Overview.$C$1];MONTH([.A23]);SUM(DAY([.A23])+1)) -> 2018-03-23
A25: of:=DATE([$Overview.$C$1];MONTH([.A24]);SUM(DAY([.A24])+1)) -> 2018-03-24
A26: of:=DATE([$Overview.$C$1];MONTH([.A25]);SUM(DAY([.A25])+1)) -> 2018-03-25
A27: of:=DATE([$Overview.$C$1];MONTH([.A26]);SUM(DAY([.A26])+1)) -> 2018-03-26
A28: of:=DATE([$Overview.$C$1];MONTH([.A27]);SUM(DAY([.A27])+1)) -> 2018-03-27
A29: of:=DATE([$Overview.$C$1];MONTH([.A28]);SUM(DAY([.A28])+1)) -> 2018-03-28
A30: of:=DATE([$Overview.$C$1];MONTH([.A29]);SUM(DAY([.A29])+1)) -> 2018-03-29
A31: of:=DATE([$Overview.$C$1];MONTH([.A30]);SUM(DAY([.A30])+1)) -> 2018-03-30
A32: of:=DATE([$Overview.$C$1];MONTH([.A31]);SUM(DAY([.A31])+1)) -> 2018-03-31

Sheet: April
B1: Hours | C1: Comment
A2: of:=DATE([$Overview.$C$1];4;1) -> 2018-04-01
A3: of:=DATE([$Overview.$C$1];MONTH([.A2]);SUM(DAY([.A2])+1)) -> 2018-04-02
A4: of:=DATE([$Overview.$C$1];MONTH([.A3]);SUM(DAY([.A3])+1)) -> 2018-04-03
A5: of:=DATE([$Overview.$C$1];MONTH([.A4]);SUM(DAY([.A4])+1)) -> 2018-04-04
A6: of:=DATE([$Overview.$C$1];MONTH([.A5]);SUM(DAY([.A5])+1)) -> 2018-04-05
A7: of:=DATE([$Overview.$C$1];MONTH([.A6]);SUM(DAY([.A6])+1)) -> 2018-04-06
A8: of:=DATE([$Overview.$C$1];MONTH([.A7]);SUM(DAY([.A7])+1)) -> 2018-04-07
A9: of:=DATE([$Overview.$C$1];MONTH([.A8]);SUM(DAY([.A8])+1)) -> 2018-04-08
A10: of:=DATE([$Overview.$C$1];MONTH([.A9]);SUM(DAY([.A9])+1)) -> 2018-04-09
A11: of:=DATE([$Overview.$C$1];MONTH([.A10]);SUM(DAY([.A10])+1)) -> 2018-04-10
A12: of:=DATE([$Overview.$C$1];MONTH([.A11]);SUM(DAY([.A11])+1)) -> 2018-04-11
A13: of:=DATE([$Overview.$C$1];MONTH([.A12]);SUM(DAY([.A12])+1)) -> 2018-04-12
A14: of:=DATE([$Overview.$C$1];MONTH([.A13]);SUM(DAY([.A13])+1)) -> 2018-04-13
A15: of:=DATE([$Overview.$C$1];MONTH([.A14]);SUM(DAY([.A14])+1)) -> 2018-04-14
A16: of:=DATE([$Overview.$C$1];MONTH([.A15]);SUM(DAY([.A15])+1)) -> 2018-04-15
A17: of:=DATE([$Overview.$C$1];MONTH([.A16]);SUM(DAY([.A16])+1)) -> 2018-04-16
A18: of:=DATE([$Overview.$C$1];MONTH([.A17]);SUM(DAY([.A17])+1)) -> 2018-04-17
A19: of:=DATE([$Overview.$C$1];MONTH([.A18]);SUM(DAY([.A18])+1)) -> 2018-04-18
A20: of:=DATE([$Overview.$C$1];MONTH([.A19]);SUM(DAY([.A19])+1)) -> 2018-04-19
A21: of:=DATE([$Overview.$C$1];MONTH([.A20]);SUM(DAY([.A20])+1)) -> 2018-04-20
A22: of:=DATE([$Overview.$C$1];MONTH([.A21]);SUM(DAY([.A21])+1)) -> 2018-04-21
A23: of:=DATE([$Overview.$C$1];MONTH([.A22]);SUM(DAY([.A22])+1)) -> 2018-04-22
A24: of:=DATE([$Overview.$C$1];MONTH([.A23]);SUM(DAY([.A23])+1)) -> 2018-04-23
A25: of:=DATE([$Overview.$C$1];MONTH([.A24]);SUM(DAY([.A24])+1)) -> 2018-04-24
A26: of:=DATE([$Overview.$C$1];MONTH([.A25]);SUM(DAY([.A25])+1)) -> 2018-04-25
A27: of:=DATE([$Overview.$C$1];MONTH([.A26]);SUM(DAY([.A26])+1)) -> 2018-04-26
A28: of:=DATE([$Overview.$C$1];MONTH([.A27]);SUM(DAY([.A27])+1)) -> 2018-04-27
A29: of:=DATE([$Overview.$C$1];MONTH([.A28]);SUM(DAY([.A28])+1)) -> 2018-04-28
A30: of:=DATE([$Overview.$C$1];MONTH([.A29]);SUM(DAY([.A29])+1)) -> 2018-04-29
A31: of:=DATE([$Overview.$C$1];MONTH([.A30]);SUM(DAY([.A30])+1)) -> 2018-04-30

Sheet: May
B1: Hours | C1: Comment
A2: of:=DATE([$Overview.$C$1];5;1) -> 2018-05-01
A3: of:=DATE([$Overview.$C$1];MONTH([.A2]);SUM(DAY([.A2])+1)) -> 2018-05-02
A4: of:=DATE([$Overview.$C$1];MONTH([.A3]);SUM(DAY([.A3])+1)) -> 2018-05-03
A5: of:=DATE([$Overview.$C$1];MONTH([.A4]);SUM(DAY([.A4])+1)) -> 2018-05-04
A6: of:=DATE([$Overview.$C$1];MONTH([.A5]);SUM(DAY([.A5])+1)) -> 2018-05-05
A7: of:=DATE([$Overview.$C$1];MONTH([.A6]);SUM(DAY([.A6])+1)) -> 2018-05-06
A8: of:=DATE([$Overview.$C$1];MONTH([.A7]);SUM(DAY([.A7])+1)) -> 2018-05-07
A9: of:=DATE([$Overview.$C$1];MONTH([.A8]);SUM(DAY([.A8])+1)) -> 2018-05-08
A10: of:=DATE([$Overview.$C$1];MONTH([.A9]);SUM(DAY([.A9])+1)) -> 2018-05-09
A11: of:=DATE([$Overview.$C$1];MONTH([.A10]);SUM(DAY([.A10])+1)) -> 2018-05-10
A12: of:=DATE([$Overview.$C$1];MONTH([.A11]);SUM(DAY([.A11])+1)) -> 2018-05-11
A13: of:=DATE([$Overview.$C$1];MONTH([.A12]);SUM(DAY([.A12])+1)) -> 2018-05-12
A14: of:=DATE([$Overview.$C$1];MONTH([.A13]);SUM(DAY([.A13])+1)) -> 2018-05-13
A15: of:=DATE([$Overview.$C$1];MONTH([.A14]);SUM(DAY([.A14])+1)) -> 2018-05-14
A16: of:=DATE([$Overview.$C$1];MONTH([.A15]);SUM(DAY([.A15])+1)) -> 2018-05-15
A17: of:=DATE([$Overview.$C$1];MONTH([.A16]);SUM(DAY([.A16])+1)) -> 2018-05-16
A18: of:=DATE([$Overview.$C$1];MONTH([.A17]);SUM(DAY([.A17])+1)) -> 2018-05-17
A19: of:=DATE([$Overview.$C$1];MONTH([.A18]);SUM(DAY([.A18])+1)) -> 2018-05-18
A20: of:=DATE([$Overview.$C$1];MONTH([.A19]);SUM(DAY([.A19])+1)) -> 2018-05-19
A21: of:=DATE([$Overview.$C$1];MONTH([.A20]);SUM(DAY([.A20])+1)) -> 2018-05-20
A22: of:=DATE([$Overview.$C$1];MONTH([.A21]);SUM(DAY([.A21])+1)) -> 2018-05-21
A23: of:=DATE([$Overview.$C$1];MONTH([.A22]);SUM(DAY([.A22])+1)) -> 2018-05-22
A24: of:=DATE([$Overview.$C$1];MONTH([.A23]);SUM(DAY([.A23])+1)) -> 2018-05-23
A25: of:=DATE([$Overview.$C$1];MONTH([.A24]);SUM(DAY([.A24])+1)) -> 2018-05-24
A26: of:=DATE([$Overview.$C$1];MONTH([.A25]);SUM(DAY([.A25])+1)) -> 2018-05-25
A27: of:=DATE([$Overview.$C$1];MONTH([.A26]);SUM(DAY([.A26])+1)) -> 2018-05-26
A28: of:=DATE([$Overview.$C$1];MONTH([.A27]);SUM(DAY([.A27])+1)) -> 2018-05-27
A29: of:=DATE([$Overview.$C$1];MONTH([.A28]);SUM(DAY([.A28])+1)) -> 2018-05-28
A30: of:=DATE([$Overview.$C$1];MONTH([.A29]);SUM(DAY([.A29])+1)) -> 2018-05-29
A31: of:=DATE([$Overview.$C$1];MONTH([.A30]);SUM(DAY([.A30])+1)) -> 2018-05-30
A32: of:=DATE([$Overview.$C$1];MONTH([.A31]);SUM(DAY([.A31])+1)) -> 2018-05-31

Sheet: June
B1: Hours | C1: Comment
A2: of:=DATE([$Overview.$C$1];6;1) -> 2018-06-01
A3: of:=DATE([$Overview.$C$1];MONTH([.A2]);SUM(DAY([.A2])+1)) -> 2018-06-02
A4: of:=DATE([$Overview.$C$1];MONTH([.A3]);SUM(DAY([.A3])+1)) -> 2018-06-03
A5: of:=DATE([$Overview.$C$1];MONTH([.A4]);SUM(DAY([.A4])+1)) -> 2018-06-04
A6: of:=DATE([$Overview.$C$1];MONTH([.A5]);SUM(DAY([.A5])+1)) -> 2018-06-05
A7: of:=DATE([$Overview.$C$1];MONTH([.A6]);SUM(DAY([.A6])+1)) -> 2018-06-06
A8: of:=DATE([$Overview.$C$1];MONTH([.A7]);SUM(DAY([.A7])+1)) -> 2018-06-07
A9: of:=DATE([$Overview.$C$1];MONTH([.A8]);SUM(DAY([.A8])+1)) -> 2018-06-08
A10: of:=DATE([$Overview.$C$1];MONTH([.A9]);SUM(DAY([.A9])+1)) -> 2018-06-09
A11: of:=DATE([$Overview.$C$1];MONTH([.A10]);SUM(DAY([.A10])+1)) -> 2018-06-10
A12: of:=DATE([$Overview.$C$1];MONTH([.A11]);SUM(DAY([.A11])+1)) -> 2018-06-11
A13: of:=DATE([$Overview.$C$1];MONTH([.A12]);SUM(DAY([.A12])+1)) -> 2018-06-12
A14: of:=DATE([$Overview.$C$1];MONTH([.A13]);SUM(DAY([.A13])+1)) -> 2018-06-13
A15: of:=DATE([$Overview.$C$1];MONTH([.A14]);SUM(DAY([.A14])+1)) -> 2018-06-14
A16: of:=DATE([$Overview.$C$1];MONTH([.A15]);SUM(DAY([.A15])+1)) -> 2018-06-15
A17: of:=DATE([$Overview.$C$1];MONTH([.A16]);SUM(DAY([.A16])+1)) -> 2018-06-16
A18: of:=DATE([$Overview.$C$1];MONTH([.A17]);SUM(DAY([.A17])+1)) -> 2018-06-17
A19: of:=DATE([$Overview.$C$1];MONTH([.A18]);SUM(DAY([.A18])+1)) -> 2018-06-18
A20: of:=DATE([$Overview.$C$1];MONTH([.A19]);SUM(DAY([.A19])+1)) -> 2018-06-19
A21: of:=DATE([$Overview.$C$1];MONTH([.A20]);SUM(DAY([.A20])+1)) -> 2018-06-20
A22: of:=DATE([$Overview.$C$1];MONTH([.A21]);SUM(DAY([.A21])+1)) -> 2018-06-21
A23: of:=DATE([$Overview.$C$1];MONTH([.A22]);SUM(DAY([.A22])+1)) -> 2018-06-22
A24: of:=DATE([$Overview.$C$1];MONTH([.A23]);SUM(DAY([.A23])+1)) -> 2018-06-23
A25: of:=DATE([$Overview.$C$1];MONTH([.A24]);SUM(DAY([.A24])+1)) -> 2018-06-24
A26: of:=DATE([$Overview.$C$1];MONTH([.A25]);SUM(DAY([.A25])+1)) -> 2018-06-25
A27: of:=DATE([$Overview.$C$1];MONTH([.A26]);SUM(DAY([.A26])+1)) -> 2018-06-26
A28: of:=DATE([$Overview.$C$1];MONTH([.A27]);SUM(DAY([.A27])+1)) -> 2018-06-27
A29: of:=DATE([$Overview.$C$1];MONTH([.A28]);SUM(DAY([.A28])+1)) -> 2018-06-28
A30: of:=DATE([$Overview.$C$1];MONTH([.A29]);SUM(DAY([.A29])+1)) -> 2018-06-29
A31: of:=DATE([$Overview.$C$1];MONTH([.A30]);SUM(DAY([.A30])+1)) -> 2018-06-30

Sheet: July
B1: Hours | C1: Comment
A2: of:=DATE([$Overview.$C$1];7;1) -> 2018-07-01
A3: of:=DATE([$Overview.$C$1];MONTH([.A2]);SUM(DAY([.A2])+1)) -> 2018-07-02
A4: of:=DATE([$Overview.$C$1];MONTH([.A3]);SUM(DAY([.A3])+1)) -> 2018-07-03
A5: of:=DATE([$Overview.$C$1];MONTH([.A4]);SUM(DAY([.A4])+1)) -> 2018-07-04
A6: of:=DATE([$Overview.$C$1];MONTH([.A5]);SUM(DAY([.A5])+1)) -> 2018-07-05
A7: of:=DATE([$Overview.$C$1];MONTH([.A6]);SUM(DAY([.A6])+1)) -> 2018-07-06
A8: of:=DATE([$Overview.$C$1];MONTH([.A7]);SUM(DAY([.A7])+1)) -> 2018-07-07
A9: of:=DATE([$Overview.$C$1];MONTH([.A8]);SUM(DAY([.A8])+1)) -> 2018-07-08
A10: of:=DATE([$Overview.$C$1];MONTH([.A9]);SUM(DAY([.A9])+1)) -> 2018-07-09
A11: of:=DATE([$Overview.$C$1];MONTH([.A10]);SUM(DAY([.A10])+1)) -> 2018-07-10
A12: of:=DATE([$Overview.$C$1];MONTH([.A11]);SUM(DAY([.A11])+1)) -> 2018-07-11
A13: of:=DATE([$Overview.$C$1];MONTH([.A12]);SUM(DAY([.A12])+1)) -> 2018-07-12
A14: of:=DATE([$Overview.$C$1];MONTH([.A13]);SUM(DAY([.A13])+1)) -> 2018-07-13
A15: of:=DATE([$Overview.$C$1];MONTH([.A14]);SUM(DAY([.A14])+1)) -> 2018-07-14
A16: of:=DATE([$Overview.$C$1];MONTH([.A15]);SUM(DAY([.A15])+1)) -> 2018-07-15
A17: of:=DATE([$Overview.$C$1];MONTH([.A16]);SUM(DAY([.A16])+1)) -> 2018-07-16
A18: of:=DATE([$Overview.$C$1];MONTH([.A17]);SUM(DAY([.A17])+1)) -> 2018-07-17
A19: of:=DATE([$Overview.$C$1];MONTH([.A18]);SUM(DAY([.A18])+1)) -> 2018-07-18
A20: of:=DATE([$Overview.$C$1];MONTH([.A19]);SUM(DAY([.A19])+1)) -> 2018-07-19
A21: of:=DATE([$Overview.$C$1];MONTH([.A20]);SUM(DAY([.A20])+1)) -> 2018-07-20
A22: of:=DATE([$Overview.$C$1];MONTH([.A21]);SUM(DAY([.A21])+1)) -> 2018-07-21
A23: of:=DATE([$Overview.$C$1];MONTH([.A22]);SUM(DAY([.A22])+1)) -> 2018-07-22
A24: of:=DATE([$Overview.$C$1];MONTH([.A23]);SUM(DAY([.A23])+1)) -> 2018-07-23
A25: of:=DATE([$Overview.$C$1];MONTH([.A24]);SUM(DAY([.A24])+1)) -> 2018-07-24
A26: of:=DATE([$Overview.$C$1];MONTH([.A25]);SUM(DAY([.A25])+1)) -> 2018-07-25
A27: of:=DATE([$Overview.$C$1];MONTH([.A26]);SUM(DAY([.A26])+1)) -> 2018-07-26
A28: of:=DATE([$Overview.$C$1];MONTH([.A27]);SUM(DAY([.A27])+1)) -> 2018-07-27
A29: of:=DATE([$Overview.$C$1];MONTH([.A28]);SUM(DAY([.A28])+1)) -> 2018-07-28
A30: of:=DATE([$Overview.$C$1];MONTH([.A29]);SUM(DAY([.A29])+1)) -> 2018-07-29
A31: of:=DATE([$Overview.$C$1];MONTH([.A30]);SUM(DAY([.A30])+1)) -> 2018-07-30
A32: of:=DATE([$Overview.$C$1];MONTH([.A31]);SUM(DAY([.A31])+1)) -> 2018-07-31

Sheet: August
B1: Hours | C1: Comment
A2: of:=DATE([$Overview.$C$1];8;1) -> 2018-08-01
A3: of:=DATE([$Overview.$C$1];MONTH([.A2]);SUM(DAY([.A2])+1)) -> 2018-08-02
A4: of:=DATE([$Overview.$C$1];MONTH([.A3]);SUM(DAY([.A3])+1)) -> 2018-08-03
A5: of:=DATE([$Overview.$C$1];MONTH([.A4]);SUM(DAY([.A4])+1)) -> 2018-08-04
A6: of:=DATE([$Overview.$C$1];MONTH([.A5]);SUM(DAY([.A5])+1)) -> 2018-08-05
A7: of:=DATE([$Overview.$C$1];MONTH([.A6]);SUM(DAY([.A6])+1)) -> 2018-08-06
A8: of:=DATE([$Overview.$C$1];MONTH([.A7]);SUM(DAY([.A7])+1)) -> 2018-08-07
A9: of:=DATE([$Overview.$C$1];MONTH([.A8]);SUM(DAY([.A8])+1)) -> 2018-08-08
A10: of:=DATE([$Overview.$C$1];MONTH([.A9]);SUM(DAY([.A9])+1)) -> 2018-08-09
A11: of:=DATE([$Overview.$C$1];MONTH([.A10]);SUM(DAY([.A10])+1)) -> 2018-08-10
A12: of:=DATE([$Overview.$C$1];MONTH([.A11]);SUM(DAY([.A11])+1)) -> 2018-08-11
A13: of:=DATE([$Overview.$C$1];MONTH([.A12]);SUM(DAY([.A12])+1)) -> 2018-08-12
A14: of:=DATE([$Overview.$C$1];MONTH([.A13]);SUM(DAY([.A13])+1)) -> 2018-08-13
A15: of:=DATE([$Overview.$C$1];MONTH([.A14]);SUM(DAY([.A14])+1)) -> 2018-08-14
A16: of:=DATE([$Overview.$C$1];MONTH([.A15]);SUM(DAY([.A15])+1)) -> 2018-08-15
A17: of:=DATE([$Overview.$C$1];MONTH([.A16]);SUM(DAY([.A16])+1)) -> 2018-08-16
A18: of:=DATE([$Overview.$C$1];MONTH([.A17]);SUM(DAY([.A17])+1)) -> 2018-08-17
A19: of:=DATE([$Overview.$C$1];MONTH([.A18]);SUM(DAY([.A18])+1)) -> 2018-08-18
A20: of:=DATE([$Overview.$C$1];MONTH([.A19]);SUM(DAY([.A19])+1)) -> 2018-08-19
A21: of:=DATE([$Overview.$C$1];MONTH([.A20]);SUM(DAY([.A20])+1)) -> 2018-08-20
A22: of:=DATE([$Overview.$C$1];MONTH([.A21]);SUM(DAY([.A21])+1)) -> 2018-08-21
A23: of:=DATE([$Overview.$C$1];MONTH([.A22]);SUM(DAY([.A22])+1)) -> 2018-08-22
A24: of:=DATE([$Overview.$C$1];MONTH([.A23]);SUM(DAY([.A23])+1)) -> 2018-08-23
A25: of:=DATE([$Overview.$C$1];MONTH([.A24]);SUM(DAY([.A24])+1)) -> 2018-08-24
A26: of:=DATE([$Overview.$C$1];MONTH([.A25]);SUM(DAY([.A25])+1)) -> 2018-08-25
A27: of:=DATE([$Overview.$C$1];MONTH([.A26]);SUM(DAY([.A26])+1)) -> 2018-08-26
A28: of:=DATE([$Overview.$C$1];MONTH([.A27]);SUM(DAY([.A27])+1)) -> 2018-08-27
A29: of:=DATE([$Overview.$C$1];MONTH([.A28]);SUM(DAY([.A28])+1)) -> 2018-08-28
A30: of:=DATE([$Overview.$C$1];MONTH([.A29]);SUM(DAY([.A29])+1)) -> 2018-08-29
A31: of:=DATE([$Overview.$C$1];MONTH([.A30]);SUM(DAY([.A30])+1)) -> 2018-08-30
A32: of:=DATE([$Overview.$C$1];MONTH([.A31]);SUM(DAY([.A31])+1)) -> 2018-08-31

Sheet: September
B1: Hours | C1: Comment
A2: of:=DATE([$Overview.$C$1];9;1) -> 2018-09-01
A3: of:=DATE([$Overview.$C$1];MONTH([.A2]);SUM(DAY([.A2])+1)) -> 2018-09-02
A4: of:=DATE([$Overview.$C$1];MONTH([.A3]);SUM(DAY([.A3])+1)) -> 2018-09-03
A5: of:=DATE([$Overview.$C$1];MONTH([.A4]);SUM(DAY([.A4])+1)) -> 2018-09-04
A6: of:=DATE([$Overview.$C$1];MONTH([.A5]);SUM(DAY([.A5])+1)) -> 2018-09-05
A7: of:=DATE([$Overview.$C$1];MONTH([.A6]);SUM(DAY([.A6])+1)) -> 2018-09-06
A8: of:=DATE([$Overview.$C$1];MONTH([.A7]);SUM(DAY([.A7])+1)) -> 2018-09-07
A9: of:=DATE([$Overview.$C$1];MONTH([.A8]);SUM(DAY([.A8])+1)) -> 2018-09-08
A10: of:=DATE([$Overview.$C$1];MONTH([.A9]);SUM(DAY([.A9])+1)) -> 2018-09-09
A11: of:=DATE([$Overview.$C$1];MONTH([.A10]);SUM(DAY([.A10])+1)) -> 2018-09-10
A12: of:=DATE([$Overview.$C$1];MONTH([.A11]);SUM(DAY([.A11])+1)) -> 2018-09-11
A13: of:=DATE([$Overview.$C$1];MONTH([.A12]);SUM(DAY([.A12])+1)) -> 2018-09-12
A14: of:=DATE([$Overview.$C$1];MONTH([.A13]);SUM(DAY([.A13])+1)) -> 2018-09-13
A15: of:=DATE([$Overview.$C$1];MONTH([.A14]);SUM(DAY([.A14])+1)) -> 2018-09-14
A16: of:=DATE([$Overview.$C$1];MONTH([.A15]);SUM(DAY([.A15])+1)) -> 2018-09-15
A17: of:=DATE([$Overview.$C$1];MONTH([.A16]);SUM(DAY([.A16])+1)) -> 2018-09-16
A18: of:=DATE([$Overview.$C$1];MONTH([.A17]);SUM(DAY([.A17])+1)) -> 2018-09-17
A19: of:=DATE([$Overview.$C$1];MONTH([.A18]);SUM(DAY([.A18])+1)) -> 2018-09-18
A20: of:=DATE([$Overview.$C$1];MONTH([.A19]);SUM(DAY([.A19])+1)) -> 2018-09-19
A21: of:=DATE([$Overview.$C$1];MONTH([.A20]);SUM(DAY([.A20])+1)) -> 2018-09-20
A22: of:=DATE([$Overview.$C$1];MONTH([.A21]);SUM(DAY([.A21])+1)) -> 2018-09-21
A23: of:=DATE([$Overview.$C$1];MONTH([.A22]);SUM(DAY([.A22])+1)) -> 2018-09-22
A24: of:=DATE([$Overview.$C$1];MONTH([.A23]);SUM(DAY([.A23])+1)) -> 2018-09-23
A25: of:=DATE([$Overview.$C$1];MONTH([.A24]);SUM(DAY([.A24])+1)) -> 2018-09-24
A26: of:=DATE([$Overview.$C$1];MONTH([.A25]);SUM(DAY([.A25])+1)) -> 2018-09-25
A27: of:=DATE([$Overview.$C$1];MONTH([.A26]);SUM(DAY([.A26])+1)) -> 2018-09-26
A28: of:=DATE([$Overview.$C$1];MONTH([.A27]);SUM(DAY([.A27])+1)) -> 2018-09-27
A29: of:=DATE([$Overview.$C$1];MONTH([.A28]);SUM(DAY([.A28])+1)) -> 2018-09-28
A30: of:=DATE([$Overview.$C$1];MONTH([.A29]);SUM(DAY([.A29])+1)) -> 2018-09-29
A31: of:=DATE([$Overview.$C$1];MONTH([.A30]);SUM(DAY([.A30])+1)) -> 2018-09-30

Sheet: October
B1: Hours | C1: Comment
A2: of:=DATE([$Overview.$C$1];10;1) -> 2018-10-01
A3: of:=DATE([$Overview.$C$1];MONTH([.A2]);SUM(DAY([.A2])+1)) -> 2018-10-02
A4: of:=DATE([$Overview.$C$1];MONTH([.A3]);SUM(DAY([.A3])+1)) -> 2018-10-03
A5: of:=DATE([$Overview.$C$1];MONTH([.A4]);SUM(DAY([.A4])+1)) -> 2018-10-04
A6: of:=DATE([$Overview.$C$1];MONTH([.A5]);SUM(DAY([.A5])+1)) -> 2018-10-05
A7: of:=DATE([$Overview.$C$1];MONTH([.A6]);SUM(DAY([.A6])+1)) -> 2018-10-06
A8: of:=DATE([$Overview.$C$1];MONTH([.A7]);SUM(DAY([.A7])+1)) -> 2018-10-07
A9: of:=DATE([$Overview.$C$1];MONTH([.A8]);SUM(DAY([.A8])+1)) -> 2018-10-08
A10: of:=DATE([$Overview.$C$1];MONTH([.A9]);SUM(DAY([.A9])+1)) -> 2018-10-09
A11: of:=DATE([$Overview.$C$1];MONTH([.A10]);SUM(DAY([.A10])+1)) -> 2018-10-10
A12: of:=DATE([$Overview.$C$1];MONTH([.A11]);SUM(DAY([.A11])+1)) -> 2018-10-11
A13: of:=DATE([$Overview.$C$1];MONTH([.A12]);SUM(DAY([.A12])+1)) -> 2018-10-12
A14: of:=DATE([$Overview.$C$1];MONTH([.A13]);SUM(DAY([.A13])+1)) -> 2018-10-13
A15: of:=DATE([$Overview.$C$1];MONTH([.A14]);SUM(DAY([.A14])+1)) -> 2018-10-14
A16: of:=DATE([$Overview.$C$1];MONTH([.A15]);SUM(DAY([.A15])+1)) -> 2018-10-15
A17: of:=DATE([$Overview.$C$1];MONTH([.A16]);SUM(DAY([.A16])+1)) -> 2018-10-16
A18: of:=DATE([$Overview.$C$1];MONTH([.A17]);SUM(DAY([.A17])+1)) -> 2018-10-17
A19: of:=DATE([$Overview.$C$1];MONTH([.A18]);SUM(DAY([.A18])+1)) -> 2018-10-18
A20: of:=DATE([$Overview.$C$1];MONTH([.A19]);SUM(DAY([.A19])+1)) -> 2018-10-19
A21: of:=DATE([$Overview.$C$1];MONTH([.A20]);SUM(DAY([.A20])+1)) -> 2018-10-20
A22: of:=DATE([$Overview.$C$1];MONTH([.A21]);SUM(DAY([.A21])+1)) -> 2018-10-21
A23: of:=DATE([$Overview.$C$1];MONTH([.A22]);SUM(DAY([.A22])+1)) -> 2018-10-22
A24: of:=DATE([$Overview.$C$1];MONTH([.A23]);SUM(DAY([.A23])+1)) -> 2018-10-23
A25: of:=DATE([$Overview.$C$1];MONTH([.A24]);SUM(DAY([.A24])+1)) -> 2018-10-24
A26: of:=DATE([$Overview.$C$1];MONTH([.A25]);SUM(DAY([.A25])+1)) -> 2018-10-25
A27: of:=DATE([$Overview.$C$1];MONTH([.A26]);SUM(DAY([.A26])+1)) -> 2018-10-26
A28: of:=DATE([$Overview.$C$1];MONTH([.A27]);SUM(DAY([.A27])+1)) -> 2018-10-27
A29: of:=DATE([$Overview.$C$1];MONTH([.A28]);SUM(DAY([.A28])+1)) -> 2018-10-28
A30: of:=DATE([$Overview.$C$1];MONTH([.A29]);SUM(DAY([.A29])+1)) -> 2018-10-29
A31: of:=DATE([$Overview.$C$1];MONTH([.A30]);SUM(DAY([.A30])+1)) -> 2018-10-30
A32: of:=DATE([$Overview.$C$1];MONTH([.A31]);SUM(DAY([.A31])+1)) -> 2018-10-31

Sheet: November
B1: Hours | C1: Comment
A2: of:=DATE([$Overview.$C$1];11;1) -> 2018-11-01
A3: of:=DATE([$Overview.$C$1];MONTH([.A2]);SUM(DAY([.A2])+1)) -> 2018-11-02
A4: of:=DATE([$Overview.$C$1];MONTH([.A3]);SUM(DAY([.A3])+1)) -> 2018-11-03
A5: of:=DATE([$Overview.$C$1];MONTH([.A4]);SUM(DAY([.A4])+1)) -> 2018-11-04
A6: of:=DATE([$Overview.$C$1];MONTH([.A5]);SUM(DAY([.A5])+1)) -> 2018-11-05
A7: of:=DATE([$Overview.$C$1];MONTH([.A6]);SUM(DAY([.A6])+1)) -> 2018-11-06
A8: of:=DATE([$Overview.$C$1];MONTH([.A7]);SUM(DAY([.A7])+1)) -> 2018-11-07
A9: of:=DATE([$Overview.$C$1];MONTH([.A8]);SUM(DAY([.A8])+1)) -> 2018-11-08
A10: of:=DATE([$Overview.$C$1];MONTH([.A9]);SUM(DAY([.A9])+1)) -> 2018-11-09
A11: of:=DATE([$Overview.$C$1];MONTH([.A10]);SUM(DAY([.A10])+1)) -> 2018-11-10
A12: of:=DATE([$Overview.$C$1];MONTH([.A11]);SUM(DAY([.A11])+1)) -> 2018-11-11
A13: of:=DATE([$Overview.$C$1];MONTH([.A12]);SUM(DAY([.A12])+1)) -> 2018-11-12
A14: of:=DATE([$Overview.$C$1];MONTH([.A13]);SUM(DAY([.A13])+1)) -> 2018-11-13
A15: of:=DATE([$Overview.$C$1];MONTH([.A14]);SUM(DAY([.A14])+1)) -> 2018-11-14
A16: of:=DATE([$Overview.$C$1];MONTH([.A15]);SUM(DAY([.A15])+1)) -> 2018-11-15
A17: of:=DATE([$Overview.$C$1];MONTH([.A16]);SUM(DAY([.A16])+1)) -> 2018-11-16
A18: of:=DATE([$Overview.$C$1];MONTH([.A17]);SUM(DAY([.A17])+1)) -> 2018-11-17
A19: of:=DATE([$Overview.$C$1];MONTH([.A18]);SUM(DAY([.A18])+1)) -> 2018-11-18
A20: of:=DATE([$Overview.$C$1];MONTH([.A19]);SUM(DAY([.A19])+1)) -> 2018-11-19
A21: of:=DATE([$Overview.$C$1];MONTH([.A20]);SUM(DAY([.A20])+1)) -> 2018-11-20
A22: of:=DATE([$Overview.$C$1];MONTH([.A21]);SUM(DAY([.A21])+1)) -> 2018-11-21
A23: of:=DATE([$Overview.$C$1];MONTH([.A22]);SUM(DAY([.A22])+1)) -> 2018-11-22
A24: of:=DATE([$Overview.$C$1];MONTH([.A23]);SUM(DAY([.A23])+1)) -> 2018-11-23
A25: of:=DATE([$Overview.$C$1];MONTH([.A24]);SUM(DAY([.A24])+1)) -> 2018-11-24
A26: of:=DATE([$Overview.$C$1];MONTH([.A25]);SUM(DAY([.A25])+1)) -> 2018-11-25
A27: of:=DATE([$Overview.$C$1];MONTH([.A26]);SUM(DAY([.A26])+1)) -> 2018-11-26
A28: of:=DATE([$Overview.$C$1];MONTH([.A27]);SUM(DAY([.A27])+1)) -> 2018-11-27
A29: of:=DATE([$Overview.$C$1];MONTH([.A28]);SUM(DAY([.A28])+1)) -> 2018-11-28
A30: of:=DATE([$Overview.$C$1];MONTH([.A29]);SUM(DAY([.A29])+1)) -> 2018-11-29
A31: of:=DATE([$Overview.$C$1];MONTH([.A30]);SUM(DAY([.A30])+1)) -> 2018-11-30
A32: of:=DATE([$Overview.$C$1];MONTH([.A31]);SUM(DAY([.A31])+1)) -> 2018-12-01

Sheet: December
B1: Hours | C1: Comment
A2: of:=DATE([$Overview.$C$1];12;1) -> 2018-12-01
A3: of:=DATE([$Overview.$C$1];MONTH([.A2]);SUM(DAY([.A2])+1)) -> 2018-12-02
A4: of:=DATE([$Overview.$C$1];MONTH([.A3]);SUM(DAY([.A3])+1)) -> 2018-12-03
A5: of:=DATE([$Overview.$C$1];MONTH([.A4]);SUM(DAY([.A4])+1)) -> 2018-12-04
A6: of:=DATE([$Overview.$C$1];MONTH([.A5]);SUM(DAY([.A5])+1)) -> 2018-12-05
A7: of:=DATE([$Overview.$C$1];MONTH([.A6]);SUM(DAY([.A6])+1)) -> 2018-12-06
A8: of:=DATE([$Overview.$C$1];MONTH([.A7]);SUM(DAY([.A7])+1)) -> 2018-12-07
A9: of:=DATE([$Overview.$C$1];MONTH([.A8]);SUM(DAY([.A8])+1)) -> 2018-12-08
A10: of:=DATE([$Overview.$C$1];MONTH([.A9]);SUM(DAY([.A9])+1)) -> 2018-12-09
A11: of:=DATE([$Overview.$C$1];MONTH([.A10]);SUM(DAY([.A10])+1)) -> 2018-12-10
A12: of:=DATE([$Overview.$C$1];MONTH([.A11]);SUM(DAY([.A11])+1)) -> 2018-12-11
A13: of:=DATE([$Overview.$C$1];MONTH([.A12]);SUM(DAY([.A12])+1)) -> 2018-12-12
A14: of:=DATE([$Overview.$C$1];MONTH([.A13]);SUM(DAY([.A13])+1)) -> 2018-12-13
A15: of:=DATE([$Overview.$C$1];MONTH([.A14]);SUM(DAY([.A14])+1)) -> 2018-12-14
A16: of:=DATE([$Overview.$C$1];MONTH([.A15]);SUM(DAY([.A15])+1)) -> 2018-12-15
A17: of:=DATE([$Overview.$C$1];MONTH([.A16]);SUM(DAY([.A16])+1)) -> 2018-12-16
A18: of:=DATE([$Overview.$C$1];MONTH([.A17]);SUM(DAY([.A17])+1)) -> 2018-12-17
A19: of:=DATE([$Overview.$C$1];MONTH([.A18]);SUM(DAY([.A18])+1)) -> 2018-12-18
A20: of:=DATE([$Overview.$C$1];MONTH([.A19]);SUM(DAY([.A19])+1)) -> 2018-12-19
A21: of:=DATE([$Overview.$C$1];MONTH([.A20]);SUM(DAY([.A20])+1)) -> 2018-12-20
A22: of:=DATE([$Overview.$C$1];MONTH([.A21]);SUM(DAY([.A21])+1)) -> 2018-12-21
A23: of:=DATE([$Overview.$C$1];MONTH([.A22]);SUM(DAY([.A22])+1)) -> 2018-12-22
A24: of:=DATE([$Overview.$C$1];MONTH([.A23]);SUM(DAY([.A23])+1)) -> 2018-12-23
A25: of:=DATE([$Overview.$C$1];MONTH([.A24]);SUM(DAY([.A24])+1)) -> 2018-12-24
A26: of:=DATE([$Overview.$C$1];MONTH([.A25]);SUM(DAY([.A25])+1)) -> 2018-12-25
A27: of:=DATE([$Overview.$C$1];MONTH([.A26]);SUM(DAY([.A26])+1)) -> 2018-12-26
A28: of:=DATE([$Overview.$C$1];MONTH([.A27]);SUM(DAY([.A27])+1)) -> 2018-12-27
A29: of:=DATE([$Overview.$C$1];MONTH([.A28]);SUM(DAY([.A28])+1)) -> 2018-12-28
A30: of:=DATE([$Overview.$C$1];MONTH([.A29]);SUM(DAY([.A29])+1)) -> 2018-12-29
A31: of:=DATE([$Overview.$C$1];MONTH([.A30]);SUM(DAY([.A30])+1)) -> 2018-12-30
A32: of:=DATE([$Overview.$C$1];MONTH([.A31]);SUM(DAY([.A31])+1)) -> 2018-12-31